{
  "schema_version": 1,
  "id": "legacy_hardcoded",
  "revision": "1",
  "units": "mm",
  "provenance": "legacy_hardcoded",
  "citation": null,
  "doi": null,
  "measurement_method": null,
  "posture": null,
  "sex": null,
  "age_range_years": null,
  "ancestry_label": null,
  "n": null,
  "notes": "TODO(verify-source): inherited implementation values at commit 24d3706b47d28d660dd700675f6f6e4536a8f886; no verified source, SD, estimator, cohort or measurement direction. Dense regions are engineering offsets, not separately measured tissue statistics.",
  "landmarks": {
    "Nasion": {
      "central_mm": 6.0,
      "estimator": null,
      "sd_mm": null,
      "p10_mm": null,
      "p90_mm": null,
      "n": null,
      "measurement_direction": null,
      "direction_notes": null,
      "notes": "",
      "provenance": "legacy_hardcoded"
    },
    "Rhinion": {
      "central_mm": 3.0,
      "estimator": null,
      "sd_mm": null,
      "p10_mm": null,
      "p90_mm": null,
      "n": null,
      "measurement_direction": null,
      "direction_notes": null,
      "notes": "",
      "provenance": "legacy_hardcoded"
    },
    "Glabella": {
      "central_mm": 5.0,
      "estimator": null,
      "sd_mm": null,
      "p10_mm": null,
      "p90_mm": null,
      "n": null,
      "measurement_direction": null,
      "direction_notes": null,
      "notes": "",
      "provenance": "legacy_hardcoded"
    },
    "Pogonion": {
      "central_mm": 10.0,
      "estimator": null,
      "sd_mm": null,
      "p10_mm": null,
      "p90_mm": null,
      "n": null,
      "measurement_direction": null,
      "direction_notes": null,
      "notes": "",
      "provenance": "legacy_hardcoded"
    },
    "Gnathion": {
      "central_mm": 10.5,
      "estimator": null,
      "sd_mm": null,
      "p10_mm": null,
      "p90_mm": null,
      "n": null,
      "measurement_direction": null,
      "direction_notes": null,
      "notes": "",
      "provenance": "legacy_hardcoded"
    },
    "Gonion_Dr": {
      "central_mm": 13.0,
      "estimator": null,
      "sd_mm": null,
      "p10_mm": null,
      "p90_mm": null,
      "n": null,
      "measurement_direction": null,
      "direction_notes": null,
      "notes": "",
      "provenance": "legacy_hardcoded"
    },
    "Gonion_St": {
      "central_mm": 13.0,
      "estimator": null,
      "sd_mm": null,
      "p10_mm": null,
      "p90_mm": null,
      "n": null,
      "measurement_direction": null,
      "direction_notes": null,
      "notes": "",
      "provenance": "legacy_hardcoded"
    },
    "Orbita_Dr_Ext": {
      "central_mm": 8.0,
      "estimator": null,
      "sd_mm": null,
      "p10_mm": null,
      "p90_mm": null,
      "n": null,
      "measurement_direction": null,
      "direction_notes": null,
      "notes": "",
      "provenance": "legacy_hardcoded"
    },
    "Orbita_St_Ext": {
      "central_mm": 8.0,
      "estimator": null,
      "sd_mm": null,
      "p10_mm": null,
      "p90_mm": null,
      "n": null,
      "measurement_direction": null,
      "direction_notes": null,
      "notes": "",
      "provenance": "legacy_hardcoded"
    },
    "Orbita_Dr_Int": {
      "central_mm": 6.0,
      "estimator": null,
      "sd_mm": null,
      "p10_mm": null,
      "p90_mm": null,
      "n": null,
      "measurement_direction": null,
      "direction_notes": null,
      "notes": "",
      "provenance": "legacy_hardcoded"
    },
    "Orbita_St_Int": {
      "central_mm": 6.0,
      "estimator": null,
      "sd_mm": null,
      "p10_mm": null,
      "p90_mm": null,
      "n": null,
      "measurement_direction": null,
      "direction_notes": null,
      "notes": "",
      "provenance": "legacy_hardcoded"
    },
    "Supraorbitale_Dr": {
      "central_mm": 7.0,
      "estimator": null,
      "sd_mm": null,
      "p10_mm": null,
      "p90_mm": null,
      "n": null,
      "measurement_direction": null,
      "direction_notes": null,
      "notes": "",
      "provenance": "legacy_hardcoded"
    },
    "Supraorbitale_St": {
      "central_mm": 7.0,
      "estimator": null,
      "sd_mm": null,
      "p10_mm": null,
      "p90_mm": null,
      "n": null,
      "measurement_direction": null,
      "direction_notes": null,
      "notes": "",
      "provenance": "legacy_hardcoded"
    },
    "Infraorbitale_Dr": {
      "central_mm": 7.0,
      "estimator": null,
      "sd_mm": null,
      "p10_mm": null,
      "p90_mm": null,
      "n": null,
      "measurement_direction": null,
      "direction_notes": null,
      "notes": "",
      "provenance": "legacy_hardcoded"
    },
    "Infraorbitale_St": {
      "central_mm": 7.0,
      "estimator": null,
      "sd_mm": null,
      "p10_mm": null,
      "p90_mm": null,
      "n": null,
      "measurement_direction": null,
      "direction_notes": null,
      "notes": "",
      "provenance": "legacy_hardcoded"
    },
    "Zygion_Dr": {
      "central_mm": 8.5,
      "estimator": null,
      "sd_mm": null,
      "p10_mm": null,
      "p90_mm": null,
      "n": null,
      "measurement_direction": null,
      "direction_notes": null,
      "notes": "",
      "provenance": "legacy_hardcoded"
    },
    "Zygion_St": {
      "central_mm": 8.5,
      "estimator": null,
      "sd_mm": null,
      "p10_mm": null,
      "p90_mm": null,
      "n": null,
      "measurement_direction": null,
      "direction_notes": null,
      "notes": "",
      "provenance": "legacy_hardcoded"
    },
    "Alare_Dr": {
      "central_mm": 4.5,
      "estimator": null,
      "sd_mm": null,
      "p10_mm": null,
      "p90_mm": null,
      "n": null,
      "measurement_direction": null,
      "direction_notes": null,
      "notes": "",
      "provenance": "legacy_hardcoded"
    },
    "Alare_St": {
      "central_mm": 4.5,
      "estimator": null,
      "sd_mm": null,
      "p10_mm": null,
      "p90_mm": null,
      "n": null,
      "measurement_direction": null,
      "direction_notes": null,
      "notes": "",
      "provenance": "legacy_hardcoded"
    },
    "Eurion_Dr": {
      "central_mm": 5.0,
      "estimator": null,
      "sd_mm": null,
      "p10_mm": null,
      "p90_mm": null,
      "n": null,
      "measurement_direction": null,
      "direction_notes": null,
      "notes": "",
      "provenance": "legacy_hardcoded"
    },
    "Eurion_St": {
      "central_mm": 5.0,
      "estimator": null,
      "sd_mm": null,
      "p10_mm": null,
      "p90_mm": null,
      "n": null,
      "measurement_direction": null,
      "direction_notes": null,
      "notes": "",
      "provenance": "legacy_hardcoded"
    },
    "Vertex_VarfCap": {
      "central_mm": 5.5,
      "estimator": null,
      "sd_mm": null,
      "p10_mm": null,
      "p90_mm": null,
      "n": null,
      "measurement_direction": null,
      "direction_notes": null,
      "notes": "",
      "provenance": "legacy_hardcoded"
    },
    "Nasospinale_BazaNas": {
      "central_mm": 11.0,
      "estimator": null,
      "sd_mm": null,
      "p10_mm": null,
      "p90_mm": null,
      "n": null,
      "measurement_direction": null,
      "direction_notes": null,
      "notes": "",
      "provenance": "legacy_hardcoded"
    },
    "Prosthion_BuzaSup": {
      "central_mm": 12.0,
      "estimator": null,
      "sd_mm": null,
      "p10_mm": null,
      "p90_mm": null,
      "n": null,
      "measurement_direction": null,
      "direction_notes": null,
      "notes": "",
      "provenance": "legacy_hardcoded"
    },
    "Acanthion": {
      "central_mm": 10.0,
      "estimator": null,
      "sd_mm": null,
      "p10_mm": null,
      "p90_mm": null,
      "n": null,
      "measurement_direction": null,
      "direction_notes": null,
      "notes": "",
      "provenance": "legacy_hardcoded"
    },
    "Piriform_Dr": {
      "central_mm": 6.5,
      "estimator": null,
      "sd_mm": null,
      "p10_mm": null,
      "p90_mm": null,
      "n": null,
      "measurement_direction": null,
      "direction_notes": null,
      "notes": "",
      "provenance": "legacy_hardcoded"
    },
    "Piriform_St": {
      "central_mm": 6.5,
      "estimator": null,
      "sd_mm": null,
      "p10_mm": null,
      "p90_mm": null,
      "n": null,
      "measurement_direction": null,
      "direction_notes": null,
      "notes": "",
      "provenance": "legacy_hardcoded"
    }
  },
  "regions": {
    "brow_median": {
      "central_mm": 5.0,
      "estimator": null,
      "sd_mm": null,
      "p10_mm": null,
      "p90_mm": null,
      "n": null,
      "measurement_direction": null,
      "direction_notes": null,
      "notes": "",
      "provenance": "legacy_hardcoded"
    },
    "punte_nazala": {
      "central_mm": 3.0,
      "estimator": null,
      "sd_mm": null,
      "p10_mm": null,
      "p90_mm": null,
      "n": null,
      "measurement_direction": null,
      "direction_notes": null,
      "notes": "",
      "provenance": "legacy_hardcoded"
    },
    "zigomatic": {
      "central_mm": 8.5,
      "estimator": null,
      "sd_mm": null,
      "p10_mm": null,
      "p90_mm": null,
      "n": null,
      "measurement_direction": null,
      "direction_notes": null,
      "notes": "",
      "provenance": "legacy_hardcoded"
    },
    "infraorbital": {
      "central_mm": 7.0,
      "estimator": null,
      "sd_mm": null,
      "p10_mm": null,
      "p90_mm": null,
      "n": null,
      "measurement_direction": null,
      "direction_notes": null,
      "notes": "",
      "provenance": "legacy_hardcoded"
    },
    "barbie": {
      "central_mm": 10.0,
      "estimator": null,
      "sd_mm": null,
      "p10_mm": null,
      "p90_mm": null,
      "n": null,
      "measurement_direction": null,
      "direction_notes": null,
      "notes": "",
      "provenance": "legacy_hardcoded"
    },
    "scalp": {
      "central_mm": 5.0,
      "notes": "Inherited dense scalp default; case config may override it.",
      "estimator": null,
      "sd_mm": null,
      "p10_mm": null,
      "p90_mm": null,
      "n": null,